"country","countryCode","date","isVerified","position","productAsin","ratingScore","reviewDescription","reviewImages/0","reviewImages/1","reviewReaction","reviewTitle","reviewUrl","reviewedIn","variant"
"United States",,"2021-11-22","false","106","B095Z5WQWM","4","The Sensodyne Pronamel intensive enamel repair whitening toothpaste is made for those with teeth that are sensitive to temperature, acids, sweets, and contact by actively repairing weakened enamel.  This toothpaste also whitens and works to prevent cavities.I use this toothpaste just like any other, and it works fine.  I don’t experience tooth sensitivity often, and my teeth are a normal shade.  The arctic breeze flavor is mild and refreshing, unlike other brands of toothpaste I’ve used with strong flavors.  After using this toothpaste over the past month, I don’t notice any changes.  My tooth enamel probably doesn’t need to be repaired.As a coffee drinker, I am concerned about staining my teeth and making them darker.  I don’t notice any difference with my teeth color, and my dentist recently confirmed my shade was normal.  Whiter teeth would be nice, but I’m more concerned with fighting stains.I don’t normally use Sensodyne toothpaste but have no concerns about doing so.  This toothpaste works as well as my normal whitening brand.  If you have sensitive teeth, perhaps the Sensodyne Pronamel intensive enamel repair whitening toothpaste is right for you.► PROS:Protects teethReduces sensitivityWhitensRefreshing flavor► CONS:None I could find",,,"One person found this helpful","Cool Flavor: A Sensodyne Pronamel Intensive Enamel Repair Whitening Toothpaste Review","https://www.amazon.com/gp/customer-reviews/R1V8V7XVN5WZV5/ref=cm_cr_arp_d_rvw_ttl?ie=UTF8&ASIN=B095Z5WQWM","Reviewed in the United States on November 22, 2021","Configuration: Toothpaste"
"United States",,"2022-07-09","false","107","B095Z5WQWM","5","Cheap",,,"","Great Product","https://www.amazon.com/gp/customer-reviews/R38H5DM7G694QD/ref=cm_cr_arp_d_rvw_ttl?ie=UTF8&ASIN=B095Z5WQWM","Reviewed in the United States on July 9, 2022","Configuration: Toothpaste"
"United States",,"2021-08-13","false","108","B095Z5WQWM","4","3 Month Update: I was having some spots show up on my teeth a month or two after switching over to this. I thought it was just part of getting old or something. At my dentist appointment the other day they told me they were stains and polished those spots right off. I'm still leaving this at 4 stars because it did work amazing for my sensitivity, but it just doesn't have enough abrasive in it to keep stains at bay.-----I have not noticed my teeth getting any whiter, but they are pretty white already (I don't drink coffee or anything) and the flavor is alright. I mean, it's toothpaste.However, when it comes to tooth sensitivity, holy cow, I am a Sensodyne convert. I'm in my mid-30's and started to notice that my teeth were sensitive to ice water, cold grapes, really anything that came out of the fridge. It wasn't painful per se, just really uncomfortable and I winced every time I'd take a sip or I'd gotten used to eating cold food on one side of my mouth that was less sensitive.2 days with Sensodyne and I noticed an immediate difference. I've been using it for a couple of months now (twice a day, I'm nearly through my first tube) and it's gotten even a bit better. I can still tell which teeth aren't thrilled about cold temps, but it's knocked the severity or uncomfortableness down from about a 6 out of 10 to a 2 out of 10.I was impressed there was such a large change in such a short amount of time. I expected a slow change over months, so I was more than excited when just a few days in I could chug ice water when I came in from mowing the lawn in the July heat. If you have teeth that are temperature sensitive, give this stuff a shot. it worked wonders for me.",,,"3 people found this helpful","Mid-30's, Sensitive Teeth-- Immediate Difference in Just a Couple of Days","https://www.amazon.com/gp/customer-reviews/R2IZB0EFSJ9KX6/ref=cm_cr_arp_d_rvw_ttl?ie=UTF8&ASIN=B095Z5WQWM","Reviewed in the United States on August 13, 2021","Configuration: Toothpaste"
"United States",,"2022-06-09","false","109","B095Z5WQWM","5","as expected",,,"","as expected","https://www.amazon.com/gp/customer-reviews/R1RIUL0GKQMOZ3/ref=cm_cr_arp_d_rvw_ttl?ie=UTF8&ASIN=B095Z5WQWM","Reviewed in the United States on June 9, 2022","Configuration: Toothpaste"
"United States",,"2021-12-01","false","110","B095Z5WQWM","4","Our son has sensitive teeth and his dentist suggested this brand, but not this particular toothpaste.  He has used this brand before with success in reducing his teeth sensitivity, so we thought this would work as well.  Our entire family has now tried this toothpaste and found that it has helped us all in varying ways.  As for whitening, we honestly haven't noticed too much of a difference though.  As far as cleaning and helping with sensitivity issues, this does work well.  The mint flavor isn't strong nor sweet, which is very nice.",,,"","An effective toothpaste that the entire family can use","https://www.amazon.com/gp/customer-reviews/R3MAZ90CF4U3Y1/ref=cm_cr_arp_d_rvw_ttl?ie=UTF8&ASIN=B095Z5WQWM","Reviewed in the United States on December 1, 2021","Configuration: Toothpaste"
"United States",,"2023-03-09","true","21","B095Z5WQWM","3","Had a different color and texture than the ones at the store but still used it and I'm fine",,,"","Good","https://www.amazon.com/gp/customer-reviews/R2YPTI5JZ8ZLJ0/ref=cm_cr_arp_d_rvw_ttl?ie=UTF8&ASIN=B095Z5WQWM","Reviewed in the United States on March 9, 2023","Configuration: Toothpaste"
"United States",,"2023-01-12","true","22","B095Z5WQWM","5","Just trying for first time",,,"","Good product","https://www.amazon.com/gp/customer-reviews/R2O0DD6TTMAPZ6/ref=cm_cr_arp_d_rvw_ttl?ie=UTF8&ASIN=B095Z5WQWM","Reviewed in the United States on January 12, 2023","Configuration: Toothpaste"
"United States",,"2023-02-27","true","23","B095Z5WQWM","3","The product was cheaper at Costco and in a larger tube",,,"","Cost/amount","https://www.amazon.com/gp/customer-reviews/R36LKDOC4EFOR4/ref=cm_cr_arp_d_rvw_ttl?ie=UTF8&ASIN=B095Z5WQWM","Reviewed in the United States on February 27, 2023","Configuration: Toothpaste"
"United States",,"2023-02-09","true","24","B095Z5WQWM","3","It does it's job, but is it really worth the price?",,,"","Getting too pricy in comparison to other brands","https://www.amazon.com/gp/customer-reviews/R1L487W52NRYN9/ref=cm_cr_arp_d_rvw_ttl?ie=UTF8&ASIN=B095Z5WQWM","Reviewed in the United States on February 9, 2023","Configuration: Toothpaste"
"United States",,"2022-11-28","true","25","B095Z5WQWM","3","I'm a long-time Sensodyne toothpaste user and love how it helps with tooth sensitivity.  I bought this pack these the advertising made it sound like this particular type of Sensodynetoothpaste had more whitening agents and more enamel repair than the pack I was using.  But when I got the pack and compared ingredients, they were identical!  The only difference was that the new tubes had less toothpaste in them....Poor business practice, Sensodyne!",,,"7 people found this helpful","Smaller size costs more!","https://www.amazon.com/gp/customer-reviews/R2SPFKNEKXQRCJ/ref=cm_cr_arp_d_rvw_ttl?ie=UTF8&ASIN=B095Z5WQWM","Reviewed in the United States on November 28, 2022","Configuration: Toothpaste"
"United States",,"2022-11-22","true","26","B095Z5WQWM","5","Does a great job repairing enamel and whitening your teeth. Highly recommend.",,,"3 people found this helpful","Best Tooth Paste On The Market","https://www.amazon.com/gp/customer-reviews/R1ZANXT5ITMAQJ/ref=cm_cr_arp_d_rvw_ttl?ie=UTF8&ASIN=B095Z5WQWM","Reviewed in the United States on November 22, 2022","Configuration: Toothpaste"
"United States",,"2022-11-04","true","27","B095Z5WQWM","5","Pronamel is the best toothpaste  I have found for daytime use.  Overtime it whitens and reduces cavities.",,,"One person found this helpful","Pronamel works!","https://www.amazon.com/gp/customer-reviews/R3OVPAWXC3A86/ref=cm_cr_arp_d_rvw_ttl?ie=UTF8&ASIN=B095Z5WQWM","Reviewed in the United States on November 4, 2022","Configuration: Toothpaste"
"United States",,"2022-09-12","true","28","B095Z5WQWM","5","The flavour, the strengthening of my teeth and enamel which has taken a beating from professional whitening over the years. This is the best product on the market for sensitive teeth, but also for strengthening and rebuilding enamel. Thank you, Amazon!!! Dr.K.",,,"5 people found this helpful","The Best toothpaste EVER!!!! Will buy this and only this brand on a continual basis.😊","https://www.amazon.com/gp/customer-reviews/RTVHSRI50XP48/ref=cm_cr_arp_d_rvw_ttl?ie=UTF8&ASIN=B095Z5WQWM","Reviewed in the United States on September 12, 2022","Configuration: Toothpaste"
"United States",,"2022-08-06","true","29","B095Z5WQWM","4","Product is great. Used it previously. Wish it would contain fluoride.",,,"","Very pleased with the product","https://www.amazon.com/gp/customer-reviews/R12U8R6DSMZ9G2/ref=cm_cr_arp_d_rvw_ttl?ie=UTF8&ASIN=B095Z5WQWM","Reviewed in the United States on August 6, 2022","Configuration: Toothpaste"
"United States",,"2022-08-12","true","30","B095Z5WQWM","5","I am currently using invisible aligners with unfortunately have made my teeth very sensitive to everything. This is doing a great job of helping and has a very nice flavor, I wasn’t too concerned about the teeth whitening, which it does a moderately good job of, but it’s a nice bonus.",,,"One person found this helpful","Works great for sensitive teeth","https://www.amazon.com/gp/customer-reviews/R3DJ5A5PRZPGVC/ref=cm_cr_arp_d_rvw_ttl?ie=UTF8&ASIN=B095Z5WQWM","Reviewed in the United States on August 12, 2022","Configuration: Toothpaste"
"United States",,"2022-05-30","true","151","B095Z5WQWM","5","Good product & price.",,,"","Product as described.","https://www.amazon.com/gp/customer-reviews/RWV4JFYQ3RZKB/ref=cm_cr_arp_d_rvw_ttl?ie=UTF8&ASIN=B095Z5WQWM","Reviewed in the United States on May 30, 2022","Configuration: Toothpaste"
"United States",,"2022-01-26","true","152","B095Z5WQWM","5","Ok",,,"","Ok","https://www.amazon.com/gp/customer-reviews/R219HSBA9LG8XS/ref=cm_cr_arp_d_rvw_ttl?ie=UTF8&ASIN=B095Z5WQWM","Reviewed in the United States on January 26, 2022","Configuration: Toothpaste"
"United States",,"2021-11-18","true","153","B095Z5WQWM","5","Like",,,"","Great toothpaste","https://www.amazon.com/gp/customer-reviews/R2AE3AH038GXV4/ref=cm_cr_arp_d_rvw_ttl?ie=UTF8&ASIN=B095Z5WQWM","Reviewed in the United States on November 18, 2021","Configuration: Toothpaste"
"United States",,"2022-06-07","true","154","B095Z5WQWM","5","I love like this product.",,,"","New flavor.","https://www.amazon.com/gp/customer-reviews/R18T7Y6FQ6FIRN/ref=cm_cr_arp_d_rvw_ttl?ie=UTF8&ASIN=B095Z5WQWM","Reviewed in the United States on June 7, 2022","Configuration: Toothpaste"
"United States",,"2022-02-17","true","155","B095Z5WQWM","5","Great product, love it",,,"","Great product","https://www.amazon.com/gp/customer-reviews/R3JFZ2F21ABEDT/ref=cm_cr_arp_d_rvw_ttl?ie=UTF8&ASIN=B095Z5WQWM","Reviewed in the United States on February 17, 2022","Configuration: Toothpaste"
"United States",,"2022-01-27","true","156","B095Z5WQWM","5","Amazinh toothpaste",,,"","Love it","https://www.amazon.com/gp/customer-reviews/RLO1SGW0ZMG2E/ref=cm_cr_arp_d_rvw_ttl?ie=UTF8&ASIN=B095Z5WQWM","Reviewed in the United States on January 27, 2022","Configuration: Toothpaste"
"United States",,"2021-12-18","true","157","B095Z5WQWM","3","it did'nt work for me.",,,"","ok job","https://www.amazon.com/gp/customer-reviews/R2STDNJKAIDWCC/ref=cm_cr_arp_d_rvw_ttl?ie=UTF8&ASIN=B095Z5WQWM","Reviewed in the United States on December 18, 2021","Configuration: Toothpaste"
"United States",,"2022-12-21","true","158","B095Z5WQWM","5","Flavor is really good,  excellent for sensitive teeth and Gums.",,,"2 people found this helpful","Boy if you have sensitive teeth this is your ticket !","https://www.amazon.com/gp/customer-reviews/R1VZ2HAQGCSYCS/ref=cm_cr_arp_d_rvw_ttl?ie=UTF8&ASIN=B095Z5WQWM","Reviewed in the United States on December 21, 2022","Configuration: Toothpaste"
"United States",,"2022-10-18","true","159","B095Z5WQWM","5","Took sensitivity away fast plus my grill looking white af!",,,"","Glossy white","https://www.amazon.com/gp/customer-reviews/R2ZZ7F1QVHSDT/ref=cm_cr_arp_d_rvw_ttl?ie=UTF8&ASIN=B095Z5WQWM","Reviewed in the United States on October 18, 2022","Configuration: Toothpaste"
"United States",,"2023-02-06","false","160","B095Z5WQWM","5","I'm not really going to review the toothpaste itself as others have already done so or if you have already tried it, there's nothing different. This is the same thing. It's great toothpaste for sensitive teeth and does a good job keeping my teeth clean and mouth feeling fresh. I just love that it arrived quickly and could be part of Amazon's same-day delivery (sorry, I forgot to go to the store!).",,,"One person found this helpful","Cheaper than at the store","https://www.amazon.com/gp/customer-reviews/R19RQUSQ6PDCY2/ref=cm_cr_arp_d_rvw_ttl?ie=UTF8&ASIN=B095Z5WQWM","Reviewed in the United States on February 6, 2023","Configuration: Toothpaste"
"United States",,"2022-08-17","true","81","B095Z5WQWM","2","I've used other Sensodyne Pronamel Repair toothpaste with great results, this product isn't even close.  Whitening? NO! At least not for me.",,,"One person found this helpful","Turned my teeth dark yellow brownish","https://www.amazon.com/gp/customer-reviews/R3LCN638BJ1RCW/ref=cm_cr_arp_d_rvw_ttl?ie=UTF8&ASIN=B095Z5WQWM","Reviewed in the United States on August 17, 2022","Configuration: Toothpaste"
"United States",,"2021-11-02","true","82","B095Z5WQWM","3","For me personally, the flavor reminded me of the smell of windex. I could not get over the flavor. Overall whitening capabilities excellent though.",,,"2 people found this helpful","Could not get over the flavor","https://www.amazon.com/gp/customer-reviews/R2AY8OPSR3DB3K/ref=cm_cr_arp_d_rvw_ttl?ie=UTF8&ASIN=B095Z5WQWM","Reviewed in the United States on November 2, 2021","Configuration: Toothpaste"
"United States",,"2021-09-12","true","83","B095Z5WQWM","5","have had less sensitivity with teeth since using",,,"","seems to work very well","https://www.amazon.com/gp/customer-reviews/R3SALL7RUS1QWM/ref=cm_cr_arp_d_rvw_ttl?ie=UTF8&ASIN=B095Z5WQWM","Reviewed in the United States on September 12, 2021","Configuration: Toothpaste"
"United States",,"2021-08-03","true","84","B095Z5WQWM","5","This toothpaste was recommended to me by my dental hygienist.",,,"One person found this helpful","Good toothpaste.","https://www.amazon.com/gp/customer-reviews/R25SG6B5QEE9EG/ref=cm_cr_arp_d_rvw_ttl?ie=UTF8&ASIN=B095Z5WQWM","Reviewed in the United States on August 3, 2021","Configuration: Toothpaste"
"United States",,"2021-10-31","true","85","B095Z5WQWM","5","nothing at this time",,,"","works","https://www.amazon.com/gp/customer-reviews/R2SLDJFQNS57T1/ref=cm_cr_arp_d_rvw_ttl?ie=UTF8&ASIN=B095Z5WQWM","Reviewed in the United States on October 31, 2021","Configuration: Toothpaste"
"United States",,"2022-04-24","true","86","B095Z5WQWM","2","Good price point, just terrible flavor. I thought it would be like the original but it’s not. Also zero whitening capabilities (or minimal) which is ok but would be nice if it was as good as the original. Otherwise enamel wise seems to work well.",,,"One person found this helpful","Not a good flavor","https://www.amazon.com/gp/customer-reviews/REO8FL3PV0T5V/ref=cm_cr_arp_d_rvw_ttl?ie=UTF8&ASIN=B095Z5WQWM","Reviewed in the United States on April 24, 2022","Configuration: Toothpaste"
"United States",,"2022-04-04","true","87","B095Z5WQWM","1","I've been using Sensodyne Pronamel for a few years. It has helped with my sensitivity problem.  However, when it came time to re-order, I saw the 'Intensive Enamel Repair' version, which claims to 'REPAIR WEAKENED ENAMEL', so I ordered a supply. When they arrived, I inspected the product and discovered that it is the EXACT same active ingredients as the standard Sensodyne toothpaste: Potassium nitrate 5%, and Sodium fluoride 0.15% w/v fluoride?  This is identical to all the Sensodyne toothpastes I've used before. I called the 1-800 CS line and got to speak to a 'rep'(?) who had no knowledge of what I wanted to know. So, to all potential buyers, know that the 'SENSODYNE INTENSIVE ENAMEL REPAIR' is no different than the rest! Very misleading advertising.",,,"36 people found this helpful","All Sensodyne Products have the exact same active ingredients.","https://www.amazon.com/gp/customer-reviews/R21SRGHS1P704X/ref=cm_cr_arp_d_rvw_ttl?ie=UTF8&ASIN=B095Z5WQWM","Reviewed in the United States on April 4, 2022","Configuration: Toothpaste"
"United States",,"2021-09-14","true","88","B095Z5WQWM","5","Works great.",,,"","Works great.","https://www.amazon.com/gp/customer-reviews/R3VAGROL4SPVZT/ref=cm_cr_arp_d_rvw_ttl?ie=UTF8&ASIN=B095Z5WQWM","Reviewed in the United States on September 14, 2021","Configuration: Toothpaste"
"United States",,"2021-09-26","true","89","B095Z5WQWM","5","Worth every penny.",,,"","Keeps my teeth whiter than the’ve ever been","https://www.amazon.com/gp/customer-reviews/R3TZ1K1EBH0CR6/ref=cm_cr_arp_d_rvw_ttl?ie=UTF8&ASIN=B095Z5WQWM","Reviewed in the United States on September 26, 2021","Configuration: Toothpaste"
"United States",,"2021-12-20","true","90","B095Z5WQWM","3","Helps with sensitive teeth",,,"","Does not leave my teeth feeling completely clean.","https://www.amazon.com/gp/customer-reviews/R12V4DCHS58LGR/ref=cm_cr_arp_d_rvw_ttl?ie=UTF8&ASIN=B095Z5WQWM","Reviewed in the United States on December 20, 2021","Configuration: Toothpaste"
"United States",,"2022-07-12","true","171","B095Z5WQWM","5","Good",,,"","A","https://www.amazon.com/gp/customer-reviews/R1YL9N2L7ZSK7G/ref=cm_cr_arp_d_rvw_ttl?ie=UTF8&ASIN=B095Z5WQWM","Reviewed in the United States on July 12, 2022","Configuration: Toothpaste"
"United States",,"2023-03-19","true","172","B095Z5WQWM","5","This is very good toothpaste if you have less than perfect teeth.  There are several different varieties.  This is my favorite.",,,"","Good toothpaste","https://www.amazon.com/gp/customer-reviews/RO2O5QIH1I07A/ref=cm_cr_arp_d_rvw_ttl?ie=UTF8&ASIN=B095Z5WQWM","Reviewed in the United States on March 19, 2023","Configuration: Toothpaste"
"United States",,"2022-01-19","true","173","B095Z5WQWM","5","((  My Teeth Feel Better.  ))",,,"","Great Stuff.","https://www.amazon.com/gp/customer-reviews/R1QISQVIY5JL4X/ref=cm_cr_arp_d_rvw_ttl?ie=UTF8&ASIN=B095Z5WQWM","Reviewed in the United States on January 19, 2022","Configuration: Toothpaste"
"United States",,"2023-01-10","true","174","B095Z5WQWM","5","Estoque necitaba exelente producto",,,"","Nice","https://www.amazon.com/gp/customer-reviews/RPC8Z1A1RV0VQ/ref=cm_cr_arp_d_rvw_ttl?ie=UTF8&ASIN=B095Z5WQWM","Reviewed in the United States on January 10, 2023","Configuration: Toothpaste"
"United States",,"2022-10-18","true","175","B095Z5WQWM","5","Nice product but no fluoride.  My dentist said to use a fluorine mouth wash to prevent cavities.",,,"One person found this helpful","Nice","https://www.amazon.com/gp/customer-reviews/RQ6HXGTS4IF7J/ref=cm_cr_arp_d_rvw_ttl?ie=UTF8&ASIN=B095Z5WQWM","Reviewed in the United States on October 18, 2022","Configuration: Toothpaste"
"United States",,"2023-02-15","true","176","B095Z5WQWM","5","It really works!!",,,"","Love it","https://www.amazon.com/gp/customer-reviews/R2YCHPD9C5X8QD/ref=cm_cr_arp_d_rvw_ttl?ie=UTF8&ASIN=B095Z5WQWM","Reviewed in the United States on February 15, 2023","Configuration: Toothpaste"
"United States",,"2022-11-22","true","177","B095Z5WQWM","5","Love this stuff and works great",,,"","Love this stuff","https://www.amazon.com/gp/customer-reviews/R1UJWO63Y4ZA4X/ref=cm_cr_arp_d_rvw_ttl?ie=UTF8&ASIN=B095Z5WQWM","Reviewed in the United States on November 22, 2022","Configuration: Toothpaste"
"United States",,"2022-10-08","true","178","B095Z5WQWM","3","Thr label on the pkg. Of 4 tubes was correct but the 4 tubes in the pkg. was incorrect the original and replacement shipments so no I'm not happy with my shipment ONLY.",,,"","Amazon shipped me the wrong merchandise in a row.  The label on tge pkg","https://www.amazon.com/gp/customer-reviews/R1NK78FN14QW0C/ref=cm_cr_arp_d_rvw_ttl?ie=UTF8&ASIN=B095Z5WQWM","Reviewed in the United States on October 8, 2022","Configuration: Toothpaste"
"United States",,"2022-07-20","true","179","B095Z5WQWM","4","These tubes are pretty small. I don’t feel like I got great value for my money, is there just not much product there",,,"2 people found this helpful","Small size","https://www.amazon.com/gp/customer-reviews/R3CYQ4RL3W84P1/ref=cm_cr_arp_d_rvw_ttl?ie=UTF8&ASIN=B095Z5WQWM","Reviewed in the United States on July 20, 2022","Configuration: Toothpaste"
"United States",,"2022-02-07","true","180","B095Z5WQWM","5","I love this product and my teeth feel naturally healthier after using it. Before, I would be a lot more sensitive but now it just feels stronger. Will be a lifelong user of Sensodyne.",,,"One person found this helpful","My teeth feel so much better after using this product","https://www.amazon.com/gp/customer-reviews/R2HSH97MMITNWB/ref=cm_cr_arp_d_rvw_ttl?ie=UTF8&ASIN=B095Z5WQWM","Reviewed in the United States on February 7, 2022","Configuration: Toothpaste"
"United States",,"2021-09-24","true","51","B095Z5WQWM","5","I like the flavor very fresh and minty but without the burning like other toothpaste. I love that it leaves my teeth feeling real clean and fresh breath. I have also noticed that I don’t have anymore sensitivity like before. I can eat anything without discomfort. My enamel has improve a lot. But I don’t feel like its whitening my teeth. But overall it’s great.",,,"8 people found this helpful","cleans teeth nicely","https://www.amazon.com/gp/customer-reviews/R1A2ASE00Z8IEU/ref=cm_cr_arp_d_rvw_ttl?ie=UTF8&ASIN=B095Z5WQWM","Reviewed in the United States on September 24, 2021","Configuration: Toothpaste"
"United States",,"2022-06-06","true","52","B095Z5WQWM","5","works wonderful my teeth and family stays whiter and cleaner highly recommended",,,"","great price great product","https://www.amazon.com/gp/customer-reviews/R3L71ZNYRJJU0E/ref=cm_cr_arp_d_rvw_ttl?ie=UTF8&ASIN=B095Z5WQWM","Reviewed in the United States on June 6, 2022","Configuration: Toothpaste"
"United States",,"2022-09-11","true","53","B095Z5WQWM","3","Good toothpaste active ingredients but WAY too expensive.",,,"","ProNamel is Good but Way Too Expensive","https://www.amazon.com/gp/customer-reviews/R1IQUPK3YF834D/ref=cm_cr_arp_d_rvw_ttl?ie=UTF8&ASIN=B095Z5WQWM","Reviewed in the United States on September 11, 2022","Configuration: Toothpaste"
"United States",,"2022-08-06","true","54","B095Z5WQWM","3","Algo no me termina de gustar. Quizá no es tan fresca como quisiera. Blanquear dientes? Falso.",,,"","No siento que estoy usando el mejor producto.","https://www.amazon.com/gp/customer-reviews/R2FU3BZA8RIPS4/ref=cm_cr_arp_d_rvw_ttl?ie=UTF8&ASIN=B095Z5WQWM","Reviewed in the United States on August 6, 2022","Configuration: Toothpaste"
"United States",,"2022-04-19","true","55","B095Z5WQWM","5","Great product, my grocery store didn’t have this type, glad I tried it seems to be working.",,,"","I really like these, think it’s workin","https://www.amazon.com/gp/customer-reviews/R36TJAUKG1JJIS/ref=cm_cr_arp_d_rvw_ttl?ie=UTF8&ASIN=B095Z5WQWM","Reviewed in the United States on April 19, 2022","Configuration: Toothpaste"
"United States",,"2022-03-27","true","56","B095Z5WQWM","5","I like the toothpaste that helps my teeth enamel. What I dislike Is the size of the tube. Why do small?",,,"","Tha toothpaste works on my teeth enamel.","https://www.amazon.com/gp/customer-reviews/R1WHTRGBWVE7QD/ref=cm_cr_arp_d_rvw_ttl?ie=UTF8&ASIN=B095Z5WQWM","Reviewed in the United States on March 27, 2022","Configuration: Toothpaste"
"United States",,"2022-06-15","true","57","B095Z5WQWM","5","It’s good toothpaste… but it",,,"One person found this helpful","Toothpaste","https://www.amazon.com/gp/customer-reviews/R290939E338OKE/ref=cm_cr_arp_d_rvw_ttl?ie=UTF8&ASIN=B095Z5WQWM","Reviewed in the United States on June 15, 2022","Configuration: Toothpaste"
"United States",,"2022-02-04","true","58","B095Z5WQWM","5","I usually purchase this item at CVS and it's really expensive even on sale.  Am so happy to have found this on Amazon for a much lower and reasonable price.",,,"","Great for Sensitive Teeth","https://www.amazon.com/gp/customer-reviews/R1SR9YLK3838GH/ref=cm_cr_arp_d_rvw_ttl?ie=UTF8&ASIN=B095Z5WQWM","Reviewed in the United States on February 4, 2022","Configuration: Toothpaste"
"United States",,"2022-03-16","true","59","B095Z5WQWM","5","Let me just say…. This toothpaste keeps my enamel intact, teeth white, and gums healthy. Don’t think twice, but it now.",,,"","TGE BEST TOOTHPASTE ON THE MARKET!!!","https://www.amazon.com/gp/customer-reviews/R2JACPE7HGVHO0/ref=cm_cr_arp_d_rvw_ttl?ie=UTF8&ASIN=B095Z5WQWM","Reviewed in the United States on March 16, 2022","Configuration: Toothpaste"
"United States",,"2022-06-01","true","60","B095Z5WQWM","5","I like it helps with pain",,,"","I love the toothpaste","https://www.amazon.com/gp/customer-reviews/R22I4HLJC8QJBP/ref=cm_cr_arp_d_rvw_ttl?ie=UTF8&ASIN=B095Z5WQWM","Reviewed in the United States on June 1, 2022","Configuration: Toothpaste"
"United States","🇺🇸","2022-09-21","true","41","B095Z5WQWM","5","Very nice product.",,,"One person found this helpful","Very nice product","https://www.amazon.com/gp/customer-reviews/RJFPF662GZMV3/ref=cm_cr_arp_d_rvw_ttl?ie=UTF8&ASIN=B095Z5WQWM","Reviewed in the United States 🇺🇸 on September 21, 2022","Configuration: Toothpaste"
