"country","countryCode","date","isVerified","position","productAsin","ratingScore","reviewDescription","reviewImages/0","reviewImages/1","reviewReaction","reviewTitle","reviewUrl","reviewedIn","variant"
"United States","🇺🇸","2022-09-10","true","42","B095Z5WQWM","5","No complaints. Does the job.",,,"One person found this helpful","Good so far","https://www.amazon.com/gp/customer-reviews/R3VHM2717CMHQC/ref=cm_cr_arp_d_rvw_ttl?ie=UTF8&ASIN=B095Z5WQWM","Reviewed in the United States 🇺🇸 on September 10, 2022","Configuration: Toothpaste"
"United States","🇺🇸","2022-09-22","true","43","B095Z5WQWM","5","Dentist recommended",,,"5 people found this helpful","Protecting sensitivity and whitening","https://www.amazon.com/gp/customer-reviews/R1OSF119A4140K/ref=cm_cr_arp_d_rvw_ttl?ie=UTF8&ASIN=B095Z5WQWM","Reviewed in the United States 🇺🇸 on September 22, 2022","Configuration: Toothpaste"
"United States","🇺🇸","2023-02-10","true","44","B095Z5WQWM","2","Not bad for getting that clean (no film) feeling but it didn’t help with tooth sensitivity and it was very irritating to the skin of my mouth and lips. I’m not sure if it was just the Arctic Breeze…which was way stronger than it needed to be…or if I’m sensitive to something in it.",,,"","Very irritating","https://www.amazon.com/gp/customer-reviews/RRI755W9DHZ2H/ref=cm_cr_arp_d_rvw_ttl?ie=UTF8&ASIN=B095Z5WQWM","Reviewed in the United States 🇺🇸 on February 10, 2023","Configuration: Toothpaste"
"United States","🇺🇸","2022-08-14","true","45","B095Z5WQWM","5","Great and gentle whitening toothpaste. Great tasting snd a good bargain!",,,"","Sensodyne Whitening Toithpaste","https://www.amazon.com/gp/customer-reviews/R2ROPXI9IP2NI2/ref=cm_cr_arp_d_rvw_ttl?ie=UTF8&ASIN=B095Z5WQWM","Reviewed in the United States 🇺🇸 on August 14, 2022","Configuration: Toothpaste"
"United States","🇺🇸","2022-07-21","true","46","B095Z5WQWM","5","We have used Sensodyne for many years.  It has helped my husband and I.  We won't use any other toothpaste.",,,"3 people found this helpful","Best Toothpaste For Older Teeth--Sensodyne","https://www.amazon.com/gp/customer-reviews/R34S80RUV4NNPI/ref=cm_cr_arp_d_rvw_ttl?ie=UTF8&ASIN=B095Z5WQWM","Reviewed in the United States 🇺🇸 on July 21, 2022","Configuration: Toothpaste"
"United States","🇺🇸","2023-04-13","true","47","B095Z5WQWM","1","I’ve use Sensodyne ProNamel for years probably decades and never had any sensitivity issues until I tried this one and now I have tooth pain bad enough that I have to take a pain pill at first I thought it was something else but I tried twice now to use it and each time I suffer for days afterwards.This may not be the case for everyone, but it just happens to be on teeth where I have had root canals. Just pay close attention when first using it.",,,"One person found this helpful","Ouch","https://www.amazon.com/gp/customer-reviews/R3RS42JHNGE8IA/ref=cm_cr_arp_d_rvw_ttl?ie=UTF8&ASIN=B095Z5WQWM","Reviewed in the United States 🇺🇸 on April 13, 2023","Configuration: Toothpaste"
"United States","🇺🇸","2021-12-30","true","48","B095Z5WQWM","4","My teeth are very sensitive from years of grinding them in my sleep. The older I get the  more important my tooth paste becomes. This is my go to tooth paste.",,,"5 people found this helpful","My favorite Tooth Paste","https://www.amazon.com/gp/customer-reviews/R3XCSA5UWFHBP/ref=cm_cr_arp_d_rvw_ttl?ie=UTF8&ASIN=B095Z5WQWM","Reviewed in the United States 🇺🇸 on December 30, 2021","Configuration: Toothpaste"
"United States","🇺🇸","2022-09-25","true","49","B095Z5WQWM","3","Brushed twice a day until all 4 tubes were gone, my teeth are not whiter",,,"2 people found this helpful","After 4 tubes","https://www.amazon.com/gp/customer-reviews/RV0SMW1NVQHF/ref=cm_cr_arp_d_rvw_ttl?ie=UTF8&ASIN=B095Z5WQWM","Reviewed in the United States 🇺🇸 on September 25, 2022","Configuration: Toothpaste"
"United States","🇺🇸","2022-02-16","true","50","B095Z5WQWM","5","Love the strong flavor and concentration of this toothpaste. Can’t find it in stores anymore. So happy to find it online! I don’t have sensitivity at all, but buy it because it makes my mouth feel clean and fresh, and whitens without being too harsh.",,,"One person found this helpful","Best Toothpaste Ever!","https://www.amazon.com/gp/customer-reviews/R3ENRZXJZMBO77/ref=cm_cr_arp_d_rvw_ttl?ie=UTF8&ASIN=B095Z5WQWM","Reviewed in the United States 🇺🇸 on February 16, 2022","Configuration: Toothpaste"
"United States",,"2021-12-17","true","141","B095Z5WQWM","5","Very good product",,,"2 people found this helpful","Works wonders my husband loves product","https://www.amazon.com/gp/customer-reviews/R4PFI7311YKKG/ref=cm_cr_arp_d_rvw_ttl?ie=UTF8&ASIN=B095Z5WQWM","Reviewed in the United States on December 17, 2021","Configuration: Toothpaste"
"United States",,"2021-12-30","true","142","B095Z5WQWM","5","I am happy with product I use Abron to clean my teeth it has a rotary head as suggested by my dentist I would suggest it because you use a lot less on a small road we had you never have to put a lot of pressure to clean because it works well the toothpaste",,,"One person found this helpful","I am happy with product","https://www.amazon.com/gp/customer-reviews/R3ETYPE1LT1LBS/ref=cm_cr_arp_d_rvw_ttl?ie=UTF8&ASIN=B095Z5WQWM","Reviewed in the United States on December 30, 2021","Configuration: Toothpaste"
"United States",,"2022-01-25","true","143","B095Z5WQWM","5","LOVE THIS STUFF!!! I bought it for a sensitivity issue, BUT it DOES BRIGHTEN  teeth and taste great as well. BIG PLUS!👍👍👍👍👍",,,"","❤️❤️❤️❤️❤️","https://www.amazon.com/gp/customer-reviews/R1LEMFCAUJJTBM/ref=cm_cr_arp_d_rvw_ttl?ie=UTF8&ASIN=B095Z5WQWM","Reviewed in the United States on January 25, 2022","Configuration: Toothpaste"
"United States",,"2022-02-06","true","144","B095Z5WQWM","5","Makes your breath fresh for sure, its the most intense of the sensodyne toothpastes ive used. Its not bad at all, just spicy.",,,"","Spicy","https://www.amazon.com/gp/customer-reviews/R1147FW7TYFHZK/ref=cm_cr_arp_d_rvw_ttl?ie=UTF8&ASIN=B095Z5WQWM","Reviewed in the United States on February 6, 2022","Configuration: Toothpaste"
"United States",,"2021-12-26","true","145","B095Z5WQWM","5","Good price for these tubes. It’s only toothpaste I use. Highly  recommended by my dentist.",,,"","Best toothpaste","https://www.amazon.com/gp/customer-reviews/R3U6D72VWJ3BJT/ref=cm_cr_arp_d_rvw_ttl?ie=UTF8&ASIN=B095Z5WQWM","Reviewed in the United States on December 26, 2021","Configuration: Toothpaste"
"United States",,"2022-02-15","true","146","B095Z5WQWM","5","Super value for great toothpaste! Fast shipping great price!",,,"","Works Great!","https://www.amazon.com/gp/customer-reviews/R1741AUBHH7NST/ref=cm_cr_arp_d_rvw_ttl?ie=UTF8&ASIN=B095Z5WQWM","Reviewed in the United States on February 15, 2022","Configuration: Toothpaste"
"United States",,"2022-03-27","true","147","B095Z5WQWM","5","Ive used for 2 or 3 years. Very saiisfied",,,"","My favorite","https://www.amazon.com/gp/customer-reviews/R1K9D31DNPZDO2/ref=cm_cr_arp_d_rvw_ttl?ie=UTF8&ASIN=B095Z5WQWM","Reviewed in the United States on March 27, 2022","Configuration: Toothpaste"
"United States",,"2022-01-04","true","148","B095Z5WQWM","5","Every time I use this toothpaste my teeth keep getting whiter and whiter",,,"","Much whiter","https://www.amazon.com/gp/customer-reviews/R2WJM2MX6KSH3S/ref=cm_cr_arp_d_rvw_ttl?ie=UTF8&ASIN=B095Z5WQWM","Reviewed in the United States on January 4, 2022","Configuration: Toothpaste"
"United States",,"2021-11-21","true","149","B095Z5WQWM","5","Backstock for ages.",,,"","New daily","https://www.amazon.com/gp/customer-reviews/RIQSD96WXHR74/ref=cm_cr_arp_d_rvw_ttl?ie=UTF8&ASIN=B095Z5WQWM","Reviewed in the United States on November 21, 2021","Configuration: Toothpaste"
"United States",,"2021-11-03","true","150","B095Z5WQWM","5","Very pleased with my results",,,"","Truely works","https://www.amazon.com/gp/customer-reviews/R3ODORBPPN9TWA/ref=cm_cr_arp_d_rvw_ttl?ie=UTF8&ASIN=B095Z5WQWM","Reviewed in the United States on November 3, 2021","Configuration: Toothpaste"
