"country","countryCode","date","isVerified","position","productAsin","ratingScore","reviewDescription","reviewImages/0","reviewImages/1","reviewReaction","reviewTitle","reviewUrl","reviewedIn","variant"
"United States",,"2023-03-22","true","1","B095Z5WQWM","5","As someone with sensitive teeth, I've struggled to find a toothpaste that effectively cleans my teeth without causing discomfort.Not only does this toothpaste leave my teeth feeling clean and fresh, but it has also significantly reduced my tooth sensitivity. I appreciate that it contains fluoride to help strengthen my enamel, and the added whitening benefits are a nice bonus.The arctic breeze flavor is refreshing and not overpowering, making brushing my teeth a pleasant experience. Overall, I am extremely satisfied with my purchase and will continue to use this toothpaste in the future.",,,"One person found this helpful","effectively cleans my teeth without causing discomfort.","https://www.amazon.com/gp/customer-reviews/RWNQKKZSDHHKZ/ref=cm_cr_arp_d_rvw_ttl?ie=UTF8&ASIN=B095Z5WQWM","Reviewed in the United States on March 22, 2023","Configuration: Toothpaste"
"United States",,"2023-04-11","true","2","B095Z5WQWM","5","I purchased on a subscription and found it to be a great value for them, half the price of the store price. I find he flavor to be nice and not overpowering, and my teeth stay white and I drink 4-5 cups of coffee a day. Highly recommended",,,"","Great value","https://www.amazon.com/gp/customer-reviews/R1WGKF7JBK19X8/ref=cm_cr_arp_d_rvw_ttl?ie=UTF8&ASIN=B095Z5WQWM","Reviewed in the United States on April 11, 2023","Configuration: Toothpaste"
"United States",,"2023-04-10","true","3","B095Z5WQWM","5","These may not whiten your teeth considerably they are nice on sensitive teeth. I recommend these tooth paste cleaning products.",,,"","Good for sensitive teeth","https://www.amazon.com/gp/customer-reviews/R2M9G8RF6TWQB4/ref=cm_cr_arp_d_rvw_ttl?ie=UTF8&ASIN=B095Z5WQWM","Reviewed in the United States on April 10, 2023","Configuration: Toothpaste"
"United States",,"2023-04-04","true","4","B095Z5WQWM","5","I like this taste and tube is so cute","https://m.media-amazon.com/images/I/61BrZDbALeL._SY88.jpg",,"","like it","https://www.amazon.com/gp/customer-reviews/R2Z24WC5LE4GF8/ref=cm_cr_arp_d_rvw_ttl?ie=UTF8&ASIN=B095Z5WQWM","Reviewed in the United States on April 4, 2023","Configuration: Toothpaste"
"United States",,"2023-03-15","true","5","B095Z5WQWM","5","Dentists loves that I'm using this: I have no cavities and my teeth are in healthy condition",,,"","Dentist is happy that I'm using this","https://www.amazon.com/gp/customer-reviews/RJIQTMQMP6ML9/ref=cm_cr_arp_d_rvw_ttl?ie=UTF8&ASIN=B095Z5WQWM","Reviewed in the United States on March 15, 2023","Configuration: Toothpaste"
"United States",,"2023-02-22","true","6","B095Z5WQWM","4","Loved flavor.  Hard to squeeze out when nearly empty ... had to leave some behind at the very end ... and it's not a very large amount to begin with.",,,"One person found this helpful","Great flavor","https://www.amazon.com/gp/customer-reviews/R2HCVDNGGIJXBT/ref=cm_cr_arp_d_rvw_ttl?ie=UTF8&ASIN=B095Z5WQWM","Reviewed in the United States on February 22, 2023","Configuration: Toothpaste"
"United States",,"2023-03-04","true","7","B095Z5WQWM","5","Love this stuff. It really helps with teeth sensitivity",,,"One person found this helpful","Love this toothpaste helps with teeth sensitivity","https://www.amazon.com/gp/customer-reviews/R2KTU8BSU6UMGB/ref=cm_cr_arp_d_rvw_ttl?ie=UTF8&ASIN=B095Z5WQWM","Reviewed in the United States on March 4, 2023","Configuration: Toothpaste"
"United States",,"2023-02-21","true","8","B095Z5WQWM","5","flavor is good. Paste is effective for sensitivity. not sure about whitening",,,"","flavor good; effective for sensitivity ; ??? about whitening","https://www.amazon.com/gp/customer-reviews/R3GFESTZ7BLR4Q/ref=cm_cr_arp_d_rvw_ttl?ie=UTF8&ASIN=B095Z5WQWM","Reviewed in the United States on February 21, 2023","Configuration: Toothpaste"
"United States",,"2023-02-05","true","9","B095Z5WQWM","5","My teeth look significantly brighter/whiter every time I brush with this. My teeth feel clean and my breath is fresh. I also believe the actual surface of my teeth are improved having been using this for several months.",,,"2 people found this helpful","Great toothpaste","https://www.amazon.com/gp/customer-reviews/RN6GTG1FUX4V6/ref=cm_cr_arp_d_rvw_ttl?ie=UTF8&ASIN=B095Z5WQWM","Reviewed in the United States on February 5, 2023","Configuration: Toothpaste"
"United States",,"2023-02-14","true","10","B095Z5WQWM","5","Great value.  Great taste and like not having to go to store to purchase.  Just have it sent to my door.",,,"One person found this helpful","My favorite toothpaste","https://www.amazon.com/gp/customer-reviews/RUWNUJLOPS0VS/ref=cm_cr_arp_d_rvw_ttl?ie=UTF8&ASIN=B095Z5WQWM","Reviewed in the United States on February 14, 2023","Configuration: Toothpaste"
"United States",,"2021-08-01","false","121","B095Z5WQWM","4","Sensedyne Pronamel intensive enamel repair whitening toothpaste…📚 Sensodyne is one of two  Toothpaste brands that my dentist uses and recommends.📚 I like using a whitening toothpaste to maintain the level of brightness of my teeth. I love my coffee and red wine so it's important for me to stay on top of whitening on a daily basis.📚 This product works well to keep my teeth white as well as protect my enamel, bonus!📚 The Minty freshness tastes great!📚 Summary… this is a winning combination in a in a dentist recommended toothpaste👍👍","https://m.media-amazon.com/images/I/814uuS4ZzSL._SY88.jpg",,"One person found this helpful","If a winning combination, dentist recommended!","https://www.amazon.com/gp/customer-reviews/R33VA2P06LR6WX/ref=cm_cr_arp_d_rvw_ttl?ie=UTF8&ASIN=B095Z5WQWM","Reviewed in the United States on August 1, 2021","Configuration: Toothpaste"
"United States",,"2021-10-29","false","122","B095Z5WQWM","5","I like many of the reviewers here have sensitive teeth. I've used this brand for years and when I decide I ""don't really need it and need to save money"", boy I can feel the difference and I switch right back to Sensodyne. Awesome brand and perfect for those struggling with teeth sensitivity. Flavor isn't intense and helps my mouth feel fresh after brushing.",,,"","Love Sensodyne!","https://www.amazon.com/gp/customer-reviews/R2PPVHXK45HAZK/ref=cm_cr_arp_d_rvw_ttl?ie=UTF8&ASIN=B095Z5WQWM","Reviewed in the United States on October 29, 2021","Configuration: Toothpaste"
"United States",,"2021-10-14","false","123","B095Z5WQWM","5","After my cancer treatments (tonsils) my teeth are crazy sensitive so I try a *lot* of these.As with other Sensodyne products, this helps sensitivity to hot or cold foods and drinks.the taste is good, and from what it says it should help deteriorated enamel .While It is not a strong whitening paste as other brands but a lot of their products aren't ( because - sensitivity) if that's fine with you then this is an excellent choice!",,,"","Fresh minty taste with good sensitivity protection","https://www.amazon.com/gp/customer-reviews/RKD296S2Y79G2/ref=cm_cr_arp_d_rvw_ttl?ie=UTF8&ASIN=B095Z5WQWM","Reviewed in the United States on October 14, 2021","Configuration: Toothpaste"
"United States",,"2021-07-29","false","124","B095Z5WQWM","5","I have used different versions of Sensodyne Pronamel for over a year now.  My go to is Intensive enamel repair because I like to think that is helping my teeth more.  I eat a lot of acidic foods and like the idea that it helps protect my teeth.  I also choose to use it in my house because my daughter's dentist recommended it for her teeth.Sensodyne has become a brand that I trust.This toothpaste is the Arctic Breeze flavor which is new to me.  It took a little time to get used to.  It is a strong flavor that lingers in my mouth after I have brushed my teeth.  It is a good strong flavor.  Definitely want to eat breakfast before brushing teeth.I have been using this brand for over a year though not this particular flavor.  Most often it is the Intensive Enamel repair  with whitening.  I feel my teeth are not as sensitive.  I also feel that my teeth are a good shade of white.  Whiter than other brands that I have used in the past.",,,"One person found this helpful","Good strong flavor.  Keeps my teeth whiter nicely.","https://www.amazon.com/gp/customer-reviews/R1PYRV3AFE0V7Z/ref=cm_cr_arp_d_rvw_ttl?ie=UTF8&ASIN=B095Z5WQWM","Reviewed in the United States on July 29, 2021","Configuration: Toothpaste"
"United States",,"2021-08-16","false","125","B095Z5WQWM","5","I had some work done on my teeth so they’re very sensitive. Sensodyne is a brand that my dentist recommended to me and one that I’ve been using for a couple years now. I love that this version has not only enamel repair but also teeth whitening. The toothpaste flavor is arctic breeze, it reminds me of a minty flavor but it's slightly different to the typical mint flavor you’ll find in most toothpaste. This toothpaste leaves a great clean and fresh feeling after brushing. I noticed that the toothpaste flavor lingers longer than most toothpaste and it leaves my breath smelling better longer. This toothpaste has a screw top and not a flip top but the top is flat so you can have the toothpaste sitting upright.","https://m.media-amazon.com/images/I/81PguodkcuL._SY88.jpg",,"","Always a reliable toothpaste","https://www.amazon.com/gp/customer-reviews/RT1ZBV5KYEV6C/ref=cm_cr_arp_d_rvw_ttl?ie=UTF8&ASIN=B095Z5WQWM","Reviewed in the United States on August 16, 2021","Configuration: Toothpaste"
"United States",,"2021-10-06","false","126","B095Z5WQWM","5","I have weak spots in my teeth that may need bonded someday. Sensodyne is the only toothpaste I trust to stop my teeth from getting sensitive. It has repaired damage and tooth sensitivity in other my teeth. It also keeps my teeth white and bright! I will never use anything else!",,,"One person found this helpful","The only toothpaste I trust!","https://www.amazon.com/gp/customer-reviews/R38H331OC0THAM/ref=cm_cr_arp_d_rvw_ttl?ie=UTF8&ASIN=B095Z5WQWM","Reviewed in the United States on October 6, 2021","Configuration: Toothpaste"
"United States",,"2021-07-26","false","127","B095Z5WQWM","5","Enamel strengthener and desensitizer; the way these toothpastes work is by filling in the tiny tubules (microscopic channels)  in the teeth with potassium ions that desensitize the nerve.  So what about ""enamel strengthening"" and ""whitener""  5% potassium nitrate is your desensitizer, and sodium fluoride  is what they mean by ""strengthen enamel) and the ingredient 5% Pentasodium triphosphate is the destainer.So if you had in past to be choosing a sensitive tooth product over whitener.. you can use this to do the entire thing. I like Colgate Optic White but a desensitizer is best when I have a cranky tooth.",,,"5 people found this helpful","A bit of everything you need","https://www.amazon.com/gp/customer-reviews/R1RO503X3363C5/ref=cm_cr_arp_d_rvw_ttl?ie=UTF8&ASIN=B095Z5WQWM","Reviewed in the United States on July 26, 2021","Configuration: Toothpaste"
"United States",,"2021-09-14","false","128","B095Z5WQWM","5","My mom uses this because she had really sensitive teeth. This keeps her teeth from being sensitive. It has a nice mint flavor. She hasn't noticed any whitening effect. I recommend.",,,"One person found this helpful","Really helps sensitivity","https://www.amazon.com/gp/customer-reviews/R28LVN0YISN8RJ/ref=cm_cr_arp_d_rvw_ttl?ie=UTF8&ASIN=B095Z5WQWM","Reviewed in the United States on September 14, 2021","Configuration: Toothpaste"
"United States",,"2021-08-29","false","129","B095Z5WQWM","5","My dentist recommended this brand to help repair the enamel on my teeth since I had been brushing too hard. It slowly whitens my teeth without any sensitivity. After about 2 weeks there was a noticeable difference in teeth whiteness. The taste is fresh and mild.",,,"","My dentist recommended this","https://www.amazon.com/gp/customer-reviews/R2LFM7HIWUJRM8/ref=cm_cr_arp_d_rvw_ttl?ie=UTF8&ASIN=B095Z5WQWM","Reviewed in the United States on August 29, 2021","Configuration: Toothpaste"
"United States",,"2021-08-17","false","130","B095Z5WQWM","5","I have used Sensodyne off and on for years. It works at least as well as any other over the counter desensitizing toothpaste, and maybe a little better, although that is difficult to quantify. Unlike other brands, Sensodyne has a removable, screw-off cap.",,,"","Brand of choice for sensitive teeth","https://www.amazon.com/gp/customer-reviews/RNSTGD2CFNAWA/ref=cm_cr_arp_d_rvw_ttl?ie=UTF8&ASIN=B095Z5WQWM","Reviewed in the United States on August 17, 2021","Configuration: Toothpaste"
"United States","🇺🇸","2023-02-16","true","11","B095Z5WQWM","5","This toothpaste really works my dentist thinks it's the best.",,,"","Good toothpaste.","https://www.amazon.com/gp/customer-reviews/R3R4VSBY7SAOHL/ref=cm_cr_arp_d_rvw_ttl?ie=UTF8&ASIN=B095Z5WQWM","Reviewed in the United States 🇺🇸 on February 16, 2023","Configuration: Toothpaste"
"United States","🇺🇸","2022-12-24","true","12","B095Z5WQWM","5","I really have a war going on with toothpaste, since it seems they only have one flavor MINT, and I truly hate this flavor and have always hated it even as a wee child! I have been using Sensodyne toothpaste since it first hit the market and truly love it (except for the MINT flavor). But this new flavor is not bad, at least it's not ""you know."" As far as the whiter teeth? Not getting that much yet, but hoping for more in the future. Still, this is a bargain and I will buy it again!",,,"2 people found this helpful","Love this flavor! IT""S NOT MINT! I HATE MINT!!!!!!!!","https://www.amazon.com/gp/customer-reviews/R10F4GN5JC5AS7/ref=cm_cr_arp_d_rvw_ttl?ie=UTF8&ASIN=B095Z5WQWM","Reviewed in the United States 🇺🇸 on December 24, 2022","Configuration: Toothpaste"
"United States","🇺🇸","2023-03-18","true","13","B095Z5WQWM","3","I very much like this product - although expensive - thought it was worth itso ordered a 4-pack of to have a good supply of . .and just noticed that all tubes are at least ONE THIRD EMPTY!!!Tremendous lack of INTEGRITY on the part of this companyjust happened to see a new tube with nightlight behind & was STUNNEDand am so greatly disappointed!!PS - did contact the company & they gave me full refund - so customer service was Excellent -they DO have INTEGRITY - and hopefully will repair their machine - and adjust it so will give fully filled tubes!","https://m.media-amazon.com/images/I/61BmwHWabyL._SY88.jpg",,"3 people found this helpful","BEWARE!!  TUBES ARE ONE THIRD EMPTY!!","https://www.amazon.com/gp/customer-reviews/R3S3S23Q7WSUG2/ref=cm_cr_arp_d_rvw_ttl?ie=UTF8&ASIN=B095Z5WQWM","Reviewed in the United States 🇺🇸 on March 18, 2023","Configuration: Toothpaste"
"United States","🇺🇸","2023-02-17","true","14","B095Z5WQWM","5","Best deal I could find",,,"","Decent price","https://www.amazon.com/gp/customer-reviews/R3JLH5R9JZP4R0/ref=cm_cr_arp_d_rvw_ttl?ie=UTF8&ASIN=B095Z5WQWM","Reviewed in the United States 🇺🇸 on February 17, 2023","Configuration: Toothpaste"
"United States","🇺🇸","2023-04-10","true","15","B095Z5WQWM","3","I have been using this a while have not really seen a difference. It’s just like a regular toothpaste to me. I have not seen a real difference in using it.",,,"One person found this helpful","Okay","https://www.amazon.com/gp/customer-reviews/R2VR8SHNXIDN6U/ref=cm_cr_arp_d_rvw_ttl?ie=UTF8&ASIN=B095Z5WQWM","Reviewed in the United States 🇺🇸 on April 10, 2023","Configuration: Toothpaste"
"United States","🇺🇸","2022-12-25","true","16","B095Z5WQWM","4","Like the flavor; not too strong. Doesn't leave that film stuff in your mouth like some toothpastes can. Great value.",,,"One person found this helpful","Does What it Says","https://www.amazon.com/gp/customer-reviews/RB5NICA787PJE/ref=cm_cr_arp_d_rvw_ttl?ie=UTF8&ASIN=B095Z5WQWM","Reviewed in the United States 🇺🇸 on December 25, 2022","Configuration: Toothpaste"
"United States","🇺🇸","2023-02-03","true","17","B095Z5WQWM","5","This was strongly recommended by our dentist's office.",,,"One person found this helpful","Recommened by our dentist's office","https://www.amazon.com/gp/customer-reviews/RKRWWC64JDF8S/ref=cm_cr_arp_d_rvw_ttl?ie=UTF8&ASIN=B095Z5WQWM","Reviewed in the United States 🇺🇸 on February 3, 2023","Configuration: Toothpaste"
"United States","🇺🇸","2023-01-29","true","18","B095Z5WQWM","5","Great toothpaste and great delivery service",,,"One person found this helpful","Great Toothpaste","https://www.amazon.com/gp/customer-reviews/R2HJP4LQH8S1ZH/ref=cm_cr_arp_d_rvw_ttl?ie=UTF8&ASIN=B095Z5WQWM","Reviewed in the United States 🇺🇸 on January 29, 2023","Configuration: Toothpaste"
"United States","🇺🇸","2023-01-24","true","19","B095Z5WQWM","5","Has helped my teeth to be stronger..",,,"One person found this helpful","My dentist recommended","https://www.amazon.com/gp/customer-reviews/R2AMJF16S2DSJX/ref=cm_cr_arp_d_rvw_ttl?ie=UTF8&ASIN=B095Z5WQWM","Reviewed in the United States 🇺🇸 on January 24, 2023","Configuration: Toothpaste"
"United States","🇺🇸","2023-01-16","true","20","B095Z5WQWM","5","This is really helping my sensitive teeth! My teeth aren't bothered as much by hot or cold foods/drinks",,,"3 people found this helpful","Very helpful","https://www.amazon.com/gp/customer-reviews/R1TXXVF9ATWIEJ/ref=cm_cr_arp_d_rvw_ttl?ie=UTF8&ASIN=B095Z5WQWM","Reviewed in the United States 🇺🇸 on January 16, 2023","Configuration: Toothpaste"
"United States",,"2021-12-30","false","111","B095Z5WQWM","4","I ordered this to help with some tooth sensitivity.Personally I didn’t notice any difference. What was weird though is that my wife noticed MORE sensitivity with her teeth.The flavor was a little pasty but not bad at all.Overall, I don’t think I would purchase this again.",,,"","I noticed no improvement. My wife’s teeth got more sensitive","https://www.amazon.com/gp/customer-reviews/R23PMXG7O5I0QA/ref=cm_cr_arp_d_rvw_ttl?ie=UTF8&ASIN=B095Z5WQWM","Reviewed in the United States on December 30, 2021","Configuration: Toothpaste"
"United States",,"2021-07-27","false","112","B095Z5WQWM","4","After using this toothpaste for a few days now, I can make several very clear observations:1.  The ""whitening,"" if it works, takes longer than a few days.  I've noticed zero difference in before/after pictures.  But that's OK - I don't mind if my teeth are tea stained.2.  I have no idea if my enamel has been repaired.  Maybe it works, maybe it doesn't.  I have no way of telling.3.  It works as well as other Sensodyne products for teeth sensitive to hot, cold, and sweet stuff.  So for me, we have a winner.  And hopefully, in the process, my enamel is getting all fixed up.Sensodyne makes a similar product that's not for the US market (likely because of FDA restrictions) that appears to be the same product, but with something that they marketing team named ""Novamax"" or something like that.  I'm curious what the actual difference there is, and if it's a better but not-yet-or-maybe-ever allowed product for the US market.Overall - a good product, the tubes are kind of small making it more expensive that most other toothpastes (even premium ones), but for sensitive teeth, you can't go wrong!  Makes your mouth and teeth feel sparkly clean, too!",,,"3 people found this helpful","Great stuff so far!","https://www.amazon.com/gp/customer-reviews/R3K0UXGJ8XZZ9M/ref=cm_cr_arp_d_rvw_ttl?ie=UTF8&ASIN=B095Z5WQWM","Reviewed in the United States on July 27, 2021","Configuration: Toothpaste"
"United States",,"2021-08-08","false","113","B095Z5WQWM","4","I have to admit that I like this toothpaste more than I thought I would. I've been using it consistently for a week now, and my tooth sensitivity has really decreased. Though it can be a little intense as I'm brushing (almost akin to the feeling you get when swishing something like Listerine), it hasn't caused any sores, irritations, or skin peeling. My teeth also seem to be a little bit whiter - it's not super-noticeable, by any means, but I do see a small change. Additionally, it makes my teeth and mouth, as a whole, feel cleaner and fresher for longer than a lot of the other toothpastes that I've tried.As for the enamel repairing benefits, I can't say that I've noticed anything, but I'm not entirely sure that that's something that one could notice outside of a dental appointment.So, aside from the aforementioned intensity that's not ideal, this is a good toothpaste, and I do recommend it.",,,"","Good Quality Toothpaste","https://www.amazon.com/gp/customer-reviews/R17XYNL1S50P9G/ref=cm_cr_arp_d_rvw_ttl?ie=UTF8&ASIN=B095Z5WQWM","Reviewed in the United States on August 8, 2021","Configuration: Toothpaste"
"United States",,"2021-09-19","false","114","B095Z5WQWM","4","I have tooth sensitivity and was pleasantly surprised by the decrease in sensitivity I experienced when biting into cold foods after using this toothpaste for a short period of time. I probably haven't used it long to enough to comment on its whitening capabilities, but it does taste very minty and fresh. This is one of the best flavored toothpastes I've tried. My only issue is the cost. This toothpaste is quite expensive compared to Colgate or Crest, and the tubes are small. I will probably mix in this toothpaste along with my normal toothpaste to keep costs down.",,,"","Expensive, but works well","https://www.amazon.com/gp/customer-reviews/R24MAKXAB80EUO/ref=cm_cr_arp_d_rvw_ttl?ie=UTF8&ASIN=B095Z5WQWM","Reviewed in the United States on September 19, 2021","Configuration: Toothpaste"
"United States",,"2021-07-25","false","115","B095Z5WQWM","4","+ For sensitive teeth+ Easy to use tube- Flavour----------------------------------------------I genuinely believed that Sensodyne was tooting their own horn a little much, but was shocked that during my first brush with this toothpaste... I didn't wince in pain. There is a section of teeth that I always had to skim over due to their sensitivity, but that wasn't an issue this time. As I haven't used this product long enough, I can't give an opinion on its whitening effects, but I will update in a month or so - or if there is noticeable change.In regards to the flavour, I'm not a big fan. I can't describe it, but it's... not the best. Compared to other mint products, this one is unusual. Of course, it could just be a ""me"" problem.",,,"","Sensitivity resolved from the first brush... honestly amazed.","https://www.amazon.com/gp/customer-reviews/R1H2ZTNRQOIT6Q/ref=cm_cr_arp_d_rvw_ttl?ie=UTF8&ASIN=B095Z5WQWM","Reviewed in the United States on July 25, 2021","Configuration: Toothpaste"
"United States",,"2021-08-11","false","116","B095Z5WQWM","4","The Seneodyne pronamel intensive enamel repaied whitening toothpaste is slightly less foamy than ordinary toothpaste, but I really like that after using it, the teeth and mouth can remain very cool fresh for a while even after drinking coffee, it is very comfortable. I can get rid of bad mouth odor without using mouthwash. After brushing, the teeth are very clean, and they are not very bleed from the gums. The teeth are indeed whiter a lot, and I have studied the ingredients containing titanium dioxide, so this white may be false white. The potassium nitrate is used to effectively reduce gum allergies. This ingredient is a relieving effect and not a cure. After I use it for a while, my gums will still be uncomfortable. The relieved effect may disappear, so I have to apply a little toothpaste on the uncomfortable gums to reduce discomfort. And children under the age of 12 should not use it.",,,"","Fresh flavor and relieved the sensitive gum","https://www.amazon.com/gp/customer-reviews/RZOYNRVS92937/ref=cm_cr_arp_d_rvw_ttl?ie=UTF8&ASIN=B095Z5WQWM","Reviewed in the United States on August 11, 2021","Configuration: Toothpaste"
"United States",,"2021-08-13","false","117","B095Z5WQWM","4","SENSODYNE PRONAMEL Intensive Enamel Repair Whitening Arctic Breeze Toothpaste for Enamel Strengthening, 3.4 Oz, Pack of 4Sensitive teeth life saverSensodyne once again shows why they’ve been around for yearsThis toothpaste hits the Mark both taste and help wiseWhile you can’t expect miracles with this toothpaste or any other toothpaste for that matter to reinstate lost enamelThanks to the amount of Fluoride this toothpaste does help repair the damaged enamel that you have leftWhile myself and my husband love the strong mint taste to this toothpaste my teens were not a fan of the strength of the mintAll in all a win for the adults in my home","https://m.media-amazon.com/images/I/71MTee0677L._SY88.jpg","https://m.media-amazon.com/images/I/71YsE9ihDSL._SY88.jpg","One person found this helpful","Love the strong mint flavor","https://www.amazon.com/gp/customer-reviews/R2WLU4ZUO92D9V/ref=cm_cr_arp_d_rvw_ttl?ie=UTF8&ASIN=B095Z5WQWM","Reviewed in the United States on August 13, 2021","Configuration: Toothpaste"
